{
  "id": "merchant_guild",
  "name": "Merchant Guild",
  "allied_factions": ["artisan_collective"],
  "rival_factions": ["thieves_den"],
  "reputation_thresholds": {
    "hostile": -51,
    "unfriendly": -50,
    "neutral": 0,
    "friendly": 1,
    "allied": 51
  },
  "description": "A powerful consortium of traders and moneylenders who control the major trade routes through Inkglass. Their influence extends into nearly every market square and dockside warehouse."
}
