{
  "id": "witches_circle",
  "name": "Witches' Circle",
  "allied_factions": [],
  "rival_factions": ["knights_moralis"],
  "reputation_thresholds": {
    "hostile": -51,
    "unfriendly": -50,
    "neutral": 0,
    "friendly": 1,
    "allied": 51
  },
  "description": "A clandestine network of brimmed witches who practice forbidden and sanctioned magic alike. They share knowledge through the Tower of Tomes and protect their own from the Knights Moralis. Membership is by invitation only."
}
